{
 "id": "paris",
 "version": 1,
 "editions": [
  "web",
  "full"
 ],
 "category": "scenic",
 "mode": "p2p",
 "laps": 1,
 "name": {
  "zh": "凯旋门到铁塔",
  "en": "Arc to Eiffel"
 },
 "blurb": {
  "zh": "开上香榭丽舍大街，绕凯旋门，从特罗卡德罗过耶拿桥到铁塔脚下。",
  "en": "Up the Champs-Élysées, round the Arc de Triomphe and over the Pont d'Iéna to the foot of the Eiffel Tower."
 },
 "origin": {
  "lat": 48.87039,
  "lon": 2.3061
 },
 "timeOfDay": "day",
 "car": "hatch",
 "spline": {
  "points": [
   [
    -11.86,
    48.72,
    8.37
   ],
   [
    -13.66,
    48.73,
    7.51
   ],
   [
    -15.46,
    48.75,
    6.64
   ],
   [
    -17.26,
    48.76,
    5.77
   ],
   [
    -19.06,
    48.78,
    4.9
   ],
   [
    -20.86,
    48.81,
    4.03
   ],
   [
    -22.67,
    48.83,
    3.17
   ],
   [
    -24.47,
    48.86,
    2.3
   ],
   [
    -26.27,
    48.89,
    1.43
   ],
   [
    -28.07,
    48.92,
    0.56
   ],
   [
    -29.87,
    48.95,
    -0.31
   ],
   [
    -31.68,
    48.98,
    -1.17
   ],
   [
    -33.48,
    49.02,
    -2.04
   ],
   [
    -35.28,
    49.05,
    -2.91
   ],
   [
    -37.08,
    49.09,
    -3.78
   ],
   [
    -38.88,
    49.12,
    -4.64
   ],
   [
    -40.69,
    49.16,
    -5.51
   ],
   [
    -42.49,
    49.2,
    -6.37
   ],
   [
    -44.29,
    49.24,
    -7.24
   ],
   [
    -46.1,
    49.28,
    -8.11
   ],
   [
    -47.9,
    49.32,
    -8.97
   ],
   [
    -49.7,
    49.36,
    -9.84
   ],
   [
    -51.51,
    49.4,
    -10.7
   ],
   [
    -53.31,
    49.45,
    -11.57
   ],
   [
    -55.11,
    49.49,
    -12.43
   ],
   [
    -56.91,
    49.53,
    -13.3
   ],
   [
    -58.72,
    49.57,
    -14.16
   ],
   [
    -60.52,
    49.61,
    -15.03
   ],
   [
    -62.32,
    49.65,
    -15.9
   ],
   [
    -64.12,
    49.69,
    -16.77
   ],
   [
    -65.92,
    49.73,
    -17.64
   ],
   [
    -67.72,
    49.76,
    -18.51
   ],
   [
    -69.52,
    49.8,
    -19.38
   ],
   [
    -71.32,
    49.84,
    -20.25
   ],
   [
    -73.13,
    49.87,
    -21.12
   ],
   [
    -74.93,
    49.91,
    -21.99
   ],
   [
    -76.73,
    49.94,
    -22.86
   ],
   [
    -78.53,
    49.98,
    -23.73
   ],
   [
    -80.33,
    50.01,
    -24.6
   ],
   [
    -82.13,
    50.05,
    -25.47
   ],
   [
    -83.93,
    50.08,
    -26.34
   ],
   [
    -85.73,
    50.12,
    -27.21
   ],
   [
    -87.53,
    50.16,
    -28.08
   ],
   [
    -89.34,
    50.2,
    -28.95
   ],
   [
    -91.14,
    50.24,
    -29.81
   ],
   [
    -92.94,
    50.28,
    -30.68
   ],
   [
    -94.74,
    50.33,
    -31.55
   ],
   [
    -96.54,
    50.37,
    -32.42
   ],
   [
    -98.35,
    50.42,
    -33.28
   ],
   [
    -100.15,
    50.47,
    -34.15
   ],
   [
    -101.95,
    50.52,
    -35.02
   ],
   [
    -103.75,
    50.58,
    -35.89
   ],
   [
    -105.55,
    50.63,
    -36.76
   ],
   [
    -107.36,
    50.69,
    -37.62
   ],
   [
    -109.16,
    50.75,
    -38.49
   ],
   [
    -110.96,
    50.81,
    -39.36
   ],
   [
    -112.76,
    50.87,
    -40.23
   ],
   [
    -114.56,
    50.93,
    -41.09
   ],
   [
    -116.37,
    50.99,
    -41.96
   ],
   [
    -118.17,
    51.05,
    -42.83
   ],
   [
    -119.97,
    51.11,
    -43.7
   ],
   [
    -121.77,
    51.18,
    -44.56
   ],
   [
    -123.57,
    51.24,
    -45.43
   ],
   [
    -125.38,
    51.3,
    -46.3
   ],
   [
    -127.18,
    51.37,
    -47.17
   ],
   [
    -128.98,
    51.43,
    -48.04
   ],
   [
    -130.78,
    51.5,
    -48.9
   ],
   [
    -132.58,
    51.56,
    -49.77
   ],
   [
    -134.38,
    51.63,
    -50.64
   ],
   [
    -136.19,
    51.7,
    -51.51
   ],
   [
    -137.99,
    51.77,
    -52.37
   ],
   [
    -139.79,
    51.84,
    -53.24
   ],
   [
    -141.59,
    51.9,
    -54.11
   ],
   [
    -143.39,
    51.97,
    -54.98
   ],
   [
    -145.2,
    52.04,
    -55.84
   ],
   [
    -147,
    52.11,
    -56.71
   ],
   [
    -148.8,
    52.18,
    -57.58
   ],
   [
    -150.6,
    52.25,
    -58.45
   ],
   [
    -152.4,
    52.32,
    -59.32
   ],
   [
    -154.21,
    52.38,
    -60.18
   ],
   [
    -156.01,
    52.45,
    -61.05
   ],
   [
    -157.81,
    52.52,
    -61.92
   ],
   [
    -159.61,
    52.58,
    -62.79
   ],
   [
    -161.41,
    52.64,
    -63.65
   ],
   [
    -163.22,
    52.71,
    -64.52
   ],
   [
    -165.02,
    52.77,
    -65.39
   ],
   [
    -166.82,
    52.82,
    -66.26
   ],
   [
    -168.62,
    52.88,
    -67.12
   ],
   [
    -170.42,
    52.94,
    -67.99
   ],
   [
    -172.23,
    53,
    -68.86
   ],
   [
    -174.03,
    53.05,
    -69.73
   ],
   [
    -175.83,
    53.1,
    -70.59
   ],
   [
    -177.63,
    53.16,
    -71.46
   ],
   [
    -179.43,
    53.21,
    -72.33
   ],
   [
    -181.24,
    53.26,
    -73.2
   ],
   [
    -183.04,
    53.31,
    -74.07
   ],
   [
    -184.84,
    53.36,
    -74.94
   ],
   [
    -186.64,
    53.4,
    -75.8
   ],
   [
    -188.44,
    53.45,
    -76.67
   ],
   [
    -190.24,
    53.5,
    -77.54
   ],
   [
    -192.05,
    53.54,
    -78.41
   ],
   [
    -193.85,
    53.59,
    -79.28
   ],
   [
    -195.65,
    53.63,
    -80.15
   ],
   [
    -197.45,
    53.67,
    -81.01
   ],
   [
    -199.25,
    53.72,
    -81.88
   ],
   [
    -201.06,
    53.76,
    -82.75
   ],
   [
    -202.86,
    53.8,
    -83.62
   ],
   [
    -204.66,
    53.84,
    -84.48
   ],
   [
    -206.46,
    53.88,
    -85.35
   ],
   [
    -208.26,
    53.91,
    -86.22
   ],
   [
    -210.06,
    53.95,
    -87.09
   ],
   [
    -211.87,
    53.99,
    -87.96
   ],
   [
    -213.67,
    54.02,
    -88.82
   ],
   [
    -215.47,
    54.06,
    -89.69
   ],
   [
    -217.27,
    54.09,
    -90.56
   ],
   [
    -219.07,
    54.12,
    -91.43
   ],
   [
    -220.88,
    54.16,
    -92.3
   ],
   [
    -222.68,
    54.19,
    -93.16
   ],
   [
    -224.48,
    54.22,
    -94.03
   ],
   [
    -226.28,
    54.25,
    -94.9
   ],
   [
    -228.08,
    54.28,
    -95.77
   ],
   [
    -229.89,
    54.31,
    -96.63
   ],
   [
    -231.69,
    54.34,
    -97.5
   ],
   [
    -233.49,
    54.37,
    -98.37
   ],
   [
    -235.29,
    54.4,
    -99.24
   ],
   [
    -237.09,
    54.43,
    -100.11
   ],
   [
    -238.89,
    54.45,
    -100.97
   ],
   [
    -240.7,
    54.48,
    -101.84
   ],
   [
    -242.5,
    54.51,
    -102.71
   ],
   [
    -244.3,
    54.54,
    -103.57
   ],
   [
    -246.1,
    54.56,
    -104.44
   ],
   [
    -247.91,
    54.59,
    -105.31
   ],
   [
    -249.71,
    54.61,
    -106.18
   ],
   [
    -251.51,
    54.64,
    -107.04
   ],
   [
    -253.31,
    54.67,
    -107.91
   ],
   [
    -255.11,
    54.69,
    -108.78
   ],
   [
    -256.92,
    54.72,
    -109.65
   ],
   [
    -258.72,
    54.74,
    -110.52
   ],
   [
    -260.52,
    54.77,
    -111.39
   ],
   [
    -262.32,
    54.79,
    -112.25
   ],
   [
    -264.12,
    54.82,
    -113.12
   ],
   [
    -265.92,
    54.84,
    -113.99
   ],
   [
    -267.73,
    54.86,
    -114.86
   ],
   [
    -269.53,
    54.89,
    -115.72
   ],
   [
    -271.33,
    54.91,
    -116.59
   ],
   [
    -273.13,
    54.93,
    -117.46
   ],
   [
    -274.93,
    54.95,
    -118.33
   ],
   [
    -276.74,
    54.98,
    -119.2
   ],
   [
    -278.54,
    55,
    -120.06
   ],
   [
    -280.34,
    55.02,
    -120.93
   ],
   [
    -282.14,
    55.04,
    -121.8
   ],
   [
    -283.94,
    55.06,
    -122.67
   ],
   [
    -285.75,
    55.08,
    -123.53
   ],
   [
    -287.55,
    55.1,
    -124.4
   ],
   [
    -289.35,
    55.12,
    -125.27
   ],
   [
    -291.15,
    55.15,
    -126.14
   ],
   [
    -292.95,
    55.17,
    -127
   ],
   [
    -294.76,
    55.19,
    -127.87
   ],
   [
    -296.56,
    55.22,
    -128.74
   ],
   [
    -298.36,
    55.24,
    -129.61
   ],
   [
    -300.16,
    55.27,
    -130.47
   ],
   [
    -301.96,
    55.29,
    -131.34
   ],
   [
    -303.77,
    55.32,
    -132.21
   ],
   [
    -305.57,
    55.35,
    -133.08
   ],
   [
    -307.37,
    55.37,
    -133.94
   ],
   [
    -309.17,
    55.4,
    -134.81
   ],
   [
    -310.97,
    55.43,
    -135.68
   ],
   [
    -312.78,
    55.46,
    -136.55
   ],
   [
    -314.58,
    55.49,
    -137.42
   ],
   [
    -316.38,
    55.52,
    -138.28
   ],
   [
    -318.18,
    55.55,
    -139.15
   ],
   [
    -319.98,
    55.59,
    -140.02
   ],
   [
    -321.79,
    55.62,
    -140.89
   ],
   [
    -323.59,
    55.65,
    -141.76
   ],
   [
    -325.39,
    55.69,
    -142.62
   ],
   [
    -327.19,
    55.72,
    -143.49
   ],
   [
    -328.99,
    55.76,
    -144.36
   ],
   [
    -330.8,
    55.8,
    -145.23
   ],
   [
    -332.6,
    55.83,
    -146.09
   ],
   [
    -334.4,
    55.87,
    -146.96
   ],
   [
    -336.2,
    55.91,
    -147.83
   ],
   [
    -338,
    55.96,
    -148.7
   ],
   [
    -339.81,
    56,
    -149.57
   ],
   [
    -341.61,
    56.05,
    -150.43
   ],
   [
    -343.41,
    56.09,
    -151.3
   ],
   [
    -345.21,
    56.14,
    -152.17
   ],
   [
    -347.01,
    56.2,
    -153.04
   ],
   [
    -348.81,
    56.25,
    -153.91
   ],
   [
    -350.61,
    56.32,
    -154.78
   ],
   [
    -352.42,
    56.38,
    -155.65
   ],
   [
    -354.22,
    56.45,
    -156.51
   ],
   [
    -356.02,
    56.52,
    -157.38
   ],
   [
    -357.82,
    56.6,
    -158.25
   ],
   [
    -359.62,
    56.68,
    -159.12
   ],
   [
    -361.43,
    56.76,
    -159.98
   ],
   [
    -363.23,
    56.85,
    -160.85
   ],
   [
    -365.03,
    56.95,
    -161.72
   ],
   [
    -366.83,
    57.04,
    -162.59
   ],
   [
    -368.63,
    57.14,
    -163.45
   ],
   [
    -370.44,
    57.25,
    -164.32
   ],
   [
    -372.24,
    57.36,
    -165.19
   ],
   [
    -374.04,
    57.47,
    -166.05
   ],
   [
    -375.84,
    57.58,
    -166.92
   ],
   [
    -377.65,
    57.69,
    -167.79
   ],
   [
    -379.45,
    57.8,
    -168.66
   ],
   [
    -381.25,
    57.92,
    -169.52
   ],
   [
    -383.05,
    58.03,
    -170.39
   ],
   [
    -384.85,
    58.14,
    -171.26
   ],
   [
    -386.65,
    58.25,